,en,ch,Chinese length,English length
46,"It all happened practically overnight. But the rich men in their expensive vehicles were too busy now to enjoy life. Huang, who was in charge of marketing, felt acutely uneasy, as if some dark force were pushing on him from behind, keeping him always on the run, taking complete control of his life. ""The company grew too quickly.",黃騰輝和同伴們從在辦公室打地鋪到公司上櫃，每個人都成了坐擁華宅、名車的千萬富翁，每天卻忙得抽不出時間來好好生活，負責行銷的黃騰輝感到非常地不實在，彷彿被一股暗潮衝得往前跑，完全失去了自主性。,88,58
47,"He predicts optimistically: ""The price of household articles in Taiwan will continue to go down."" Not only that, but as consumers learn to keep abreast of new promotions and seek out the discounted products which suit their needs, they will imperceptibly acquire wiser and more rational consuming habits.",談學睿樂觀的評估，「未來台灣百貨用品的價格，還是會繼續往下走。」不僅如此，當消費者都懂得定期索取新的促銷廣告，並且按圖索驥地選購自己需要的折價品時，無形中也培養出更精明、更理性的消費習慣。,84,48
48,She respects life and accepts physical disability as a furnace to temper her will.,她尊敬生命，歌頌經過淬煉的人生，在「生命生命」文中，她寫道：「雖然肉體的生命短暫，生老病死的過程也往往令人無法捉摸，但是從有限的生命發揮無限的價值，使我們活得更為光彩有力，卻在於我們自己的掌握。」,85,14
49,"""Something that is part of the World Heritage cannot be seen exclusively with the eye,"" cautions Alice Ruhwa Chiu, executive director of the Yaoshan Cultural Foundation, who in recent years has been untiring in her promotion of the World Heritage concept.",然而，人類歷史淵源流長，究竟什麼才夠格叫做「世界遺產」？如何申請？教科文組織對文化資產與自然資產分別制訂了一套的評定基準。文化資產至少必須具有下列六項標準之一：一、表現人類創造力的經典之作。,85,41
50,"Scenic spots on Yangmingshan have become famous through word of mouth. Apart from Bamboo Lake, which is known today for its stir-fried vegetables, there is also Chingtienkang. One tragic night before the park was founded, hikers lost their way here coming through the grass in a thick fog. Now Chingtienkang has become an outdoor picnic area that can accommodate over 1000 people.",許多景點因遊客的口耳相傳更聲名大噪，除近來以吃炒青菜聞名的竹子湖外，國家公園成立以前，擎天崗還因茅草過高，入夜霧氣迷離而發生過山難，如今擎天崗已成了一次可容上千旅客的野餐區。,81,62
51,"B: That was a time when Cambridge was quite generously staffed by outstanding sinologists, such as Twitchett, Van der Loon, Elvin and others.",答：一九七六年我進劍橋時，中文系並沒有教授席，但當時的老師們，如今個個都是德高望重的大教授，像主持「劍橋中國史」的 Twitchett，教中國文學的龍彼得等，且課程的範圍從古典到現代，從歷史、文學、政治到藝術，囊括極廣。,86,23
52,"As the doctrine of Tenrikyo, which stresses respect for ancestors, filial piety, self-cultivation, and service to mankind, coincides with traditional ethics and the concept of universal brotherhood of the Chinese people, the religion is readily accepted in Taiwan. In 1973, the Ministry of Interior permitted the establishment of a Tenrikyo mission headquarters in Taiwan, and the number of followers has since grown rapidly.",由於天理教的教義是尊祖先、孝父母、修養自身、服務人群，使大家能過安和樂利、充滿朝氣的康樂生活，與中國人傳統的倫理觀念與世界大同的目標極為相近，所以極易為國人領會和接受，因此信徒也逐年增加。,85,63
53,"In late June this year, Grace Tung held an exhibition of her calligraphy at the Spring Gallery in Taipei which fully showed her majestic strength and fluid dignity.",今年六月下旬，董陽孜在台北「春之藝廊」展出了她的書法作品。董陽孜的書法，筆力磅礡，氣勢雄渾；揮灑之間，絲毫不見拘泥之態。一種傾向陽剛之美的壯麗，令人覺得她運筆如揮劍；雖手如柔荑，而力能扛鼎。,82,28
54,"Since 1949, a number of new universities have been established in Taiwan; all of them, however, are located in the northern part of the island. To have a geographically balanced development of higher education and to answer the appeal of communities in the Kaohsiung-Pingtung area, the Ministry of Education decided to reestablish National Sun Yat-sen University in Kaohsiung.",後經在台校友為復校奔走呼籲，加上目前大學多集中在北部，高屏地方人士也籲請政府在南部設置大學，教育部乃決定中山大學在高雄西子灣復校。民國六十八年七月成立籌備處，由前救國團主任李煥主持。,85,58
55,"According to my understanding, there are more than 1200 people in the ICAC in Hong Kong. Among these, 70 percent come from among the people and the remaining 30 percent come from other government agencies. Hong Kong has a population of only 6 million. With our 20 million people, how big an anti-corruption commission would we need?",據我所知，香港廉政公署的人員有一千兩百多人，其中百分之七十是來自民間，其餘百分之卅來自政府其他機構；香港僅有六百萬居民，就有這麼多的肅貪人員，那我們有兩千萬人口，又要成立多大的肅貪機構？,85,57
56,"We'll send you back to the mainland! ""I always tell my daughter-in-law she must have sharp eyes to have married my son and not some old man."" Now that his daughter-in-law has been granted permission to take up residence in Taiwan, this thoroughly authoritarian grandfather cannot help constantly comparing his eldest grandchild, who came to Taiwan some time ago, with her younger brother who has just arrived here with their mother.",「我一直告訴媳婦，你是眼睛很『金』，才會嫁給我兒子，沒有嫁給什麼老頭子」，現在媳婦獲准入境台灣居留，這位頗具權威的祖父，不免老是要將早就帶來台灣的長孫女和這次才跟媳婦來台的孫子比較一番。,82,71
57,"From 1964 to 1970, Raymond Chow, formerly head of publicity for Shaw Brothers, took over responsibility for production. This was a very important period for the studio, when Chow aggressively recruited talent, expanded production facilities, increased output, raised quality, and developed ties to other industries.",一九六四至一九七○年，時任邵氏宣傳部經理的鄒文懷主持製片業務，這是邵氏發展史上極重要的時期。鄒文懷廣羅人才，擴充片廠，增加影片，提高拍攝水準，並勤於發展外界關係，使得邵氏能有發揮空間。,82,45
58,"Also, based on other nations 'histories, improvement of the constitution is a gradual process. The ROC's constitutional history is short. Perhaps the con stitution is not ideal, but it should grow with society. Extreme measures could create aftereffects.",再者，根據現代各國憲政歷史的經驗，憲法的日趨完美是漸進成長的，我國憲政成長的歷史尚短，經驗也不足，因此也許不理想，但必須隨著國家社會的整體進步而成長，激烈的手段只會導致更多後遺症。,82,38
59,"As Freud said, love and work are the two fundamental elements of human life. Maslow built upon this with the concept of a hierarchy of needs, starting with personal safety and security, and building up to the need for self-actualization. In Huang Ho-ming, we can see a concrete example of these ideas in action.",精神分析大師佛洛依德曾經寫道：「愛與工作」是人類兩大基本需求；另一位心理學家馬斯洛則將這理論發揚光大，說需求有不同層次，從基本的生存發展、安全需求，最後到自我實現，而從黃河明身上，我們看見了具體的實踐。,90,54
60,"Yu took the advice, and eventually her work was presented on CTV, with Tsai as producer.",忙了一個月，劇本費沒拿到，又把工作辭了，而那個製作人介紹的工作也沒有著落。換句話說，玉笠人失業了。她未婚，又是獨生女，父母年紀大了，她必須負擔家計，因此很急於再找個工作。有人建議她不妨寫個劇本給中視「名劇精選」的製作人翟瑞。,98,16
61,"The Environmental Protection Bureau has established future utilization goals for various sections of the river (see map), such as irrigation, recreation, and public use... but the most practical short-term aim is--stopping the river from smelling during the summer within four years.",這條河扮演的不只是浪漫、泛舟或休閒、娛樂的角色，在衛生署環保局的整治計畫中，就定出了未來河段分類目標（見圖表），那裡做為供水、灌溉之用，那裡是生態保護區、遊憩區… …，而最實際的近期目標是：四年後，淡水河在夏天不再發臭。,93,41
62,Dr. Shen Ch'ien: Today I'd like to discuss with everyone a work of Liang Shih-chiu's with which I'm sure we are all familiar--Sketches of a Cottager.,當年和他一起的知識份子，很多都願意攻擊現實、附和魯迅，而梁先生卻敢和魯迅對抗，這不僅需要道德勇氣，而且必須耐得住寂寞。低眉菩薩與怒目金剛沈謙教授：我今天要談的是梁先生最為大家所熟悉的作品﹘ ﹘「雅舍小品」的藝術層面。,95,26
63,"Overseas, boars are considered ""game animals""; their numbers and habits have been studied, and seasons and limits have been set on hunting them.",野豬一類的動物，在國外多被視為「可供狩獵動物」﹘﹘瞭解它在各地區的數量、生活習性後，做出可供狩獵的量表，並限定可以獵殺的野豬數量及大小，便可有限度地開放狩獵。如此，使人能享狩獵之樂，野豬也能維持固定數量，不致絕種。,93,23
64,"In the past Taiwan placed excessive importance on fossil fuels and nuclear energy, and created a monopoly of electrical power supply, thereby excluding opportunities for development of renewable sources of energy. Thus the President emphasized, ""In the future we should, acting through liberalization of the power market and various subsidy measures, increase incentives for diversification of sources of energy.""",此外，台灣長期以來過份強調火力及核能發電，且電力供應為獨占市場，排擠了許多再生能源獲得開發的機會，因此，「未來應透過電力市場的自由化及各種補助措施，增加業者開發的誘因，促進能源的多元化，降低對進口能源的依賴。」,94,59
65,"Last year, about 80 percent of Taiwan's tea production, amounting to 27,000 tons was exported.",如此一來，台灣的茶葉不但品種多，產量更逐年增加，不但能滿足國人的需要，也成為我國外銷的主要農產品之一。像去（六十八）年台茶的總產量已達二萬七千多噸，其中百分之七十外銷，行銷世界各地，為我國賺取了兩千五百多萬美元的外匯。,98,15
66,"Although the government has taken good precautions, it is only if everyone has the correct ideas about hygiene to prevent cholera infection -- avoiding raw food and drink, washing hands and implements before and after preparing food--can safety be ensured. If one should happen to produce symptoms of vomiting and diarrhoea then medical help should be sought immediately; if cholera is confirmed then electrolytes should be inected and copious amounts of water taken.",雖然政府有完善措施，但是一般民眾最好還是要有正確的衛生觀念，為了防止感染霍亂，應避免生飲生食，進食前後不忘洗滌雙手及餐具，如此才能確保安全；萬一發生上吐下瀉，應立即就醫；如果確定感染霍亂，要注射電解質及大量補充水份。,98,73
67,"Select one section of bamboo, fill it two-thirds full of rice and water, then cover the opening with a banana leaf.",成品複雜精細，有畚箕、斗笠、米簍等近百種，觀眾看得讚嘆不已。另外，為了舉辦此次竹藝展，主辦單位特別在事前舉行竹工藝品研習會，由縣內各國小教務、總務主任參加，結訓後再挑出十位成績最優者在會場教導民眾竹編工藝。,92,21
68,"According to retailing experts, a large department store needs a population of around 300,000 to support it. Taipei and the surrounding suburbs together account for a four-million-person base, on which 20-some department stores and countless smaller retailers rest their profit hopes.",根據百貨業專家的估算，要養活一家大型綜合百貨公司，至少需要卅萬的人口。以大台北地區四百多萬活動人口的荷包，卻有廿幾家百貨公司，加上林立的服裝專賣店、專業超市，以及各類零售店爭奪瓜分，百貨業似乎前途無「亮」。,92,41
69,"After doing some research on tennis, in which he started gaining great interest, he returned home to Chiayi, and got some girls together to practice with. This was the beginning of the Chu-chi Middle School girls 'tennis team. These girls later fulfilled Chang's dreams by beating some of the older national players. Chang points out that the Chu-chi team attracted a lot of attention for two reasons.",後來他慢慢地接觸，看書、看比賽、找人談論，對這種圓滾滾的小黃球愈來愈有興趣，剛好有一個機會，他回到了自己的家鄉嘉義竹崎，在等服兵役的空檔，找來幾個孩子練球，這就是被稱為「網壇紅葉」的竹崎國中女網隊誕生的緣由。,92,67
70,"Each year, some 30,000 pilgrims from Tachia accompany their goddess Matsu on a pilgrimage to Peikang to reaffirm her ties with the mother temple there and to demonstrate the deep faith the people of Tachia have in her.",他們認為，唯有這樣才能表示他們對媽祖的誠心；也唯有這樣，他們許的心願才能一步一步地落實下來。大甲媽祖在鎮瀾宮「起駕」時，有萬餘信徒跟著她。沿途行經的鄉鎮，不斷有人加入。於是進香的行列愈來愈長，終而匯成一條五、六萬人的進香大河。,100,38
71,"As for the question about whether the Thao, which had only 300 surviving members, was a lowland tribe, in 1953 Chen Chi-lu devised a plan to trace their roots and determined that the Thao belonged to neither the Bunun nor the Tsou. In 2001, the Thao were officially recognized by the government as Taiwan's tenth Aboriginal tribe.",人數僅剩三百人的邵族，究竟是不是平埔族，其考究可溯源自一九五三年人類學者陳奇祿主持的計劃，而後台大確定邵族不能歸為布農族或鄒族，應該是獨立的一族，至二○○一年，邵族才正式被政府核定為台灣原住民的第十族。,92,57
72,"The good one: Canto-Pop really is one unique class of music that manages to combine musical roots of the Eastern hemisphere with Western rhythms, and hence should possibly be interesting to both. The bad one: Only one music label in Hong Kong answered my requests for any information on that topic. One out of ten!",喜的是，粵語流行歌的確是個別具特色的音樂類型，它成功地融合了東方音樂的基礎和西方音樂的節奏，理當在東西兩地都受到青睞；憂的是，當我針對這個問題向香港的十家唱片發行公司提出疑問並請求答覆時，竟然只有一家有回音！,97,55
73,"In 1960, during the pro-democracy movement led by Lei Chen, Hsieh Han-lu, then a member of the Taiwan Provincial Assembly, became executive secretary of the ""election reform association."" As a result, during those four critical months in the history of Taiwan, he not only participated in this effort among intellectuals to do something for their country, he personally experienced the atmosphere of fear of a Kuomintang purge.",在一九六○年以雷震為首的民主運動中，時為台灣省參議會參議員的謝漢儒，因身任「選改會」執行秘書，在台灣民主運動最關鍵的四個月裡，不只參與了當時知識分子對國家的行動熱血，也親身經歷了當年國民黨整肅的恐怖氛圍。,93,67
74,"After the sky lantern lighting ceremony, visitors come to the end of their experience at the Taiwan Pavilion. Their last stop is a city square, which is formed out of a large tree woven from bamboo by craftspeople from Nantou. As visitors come together to ""cool off"" under the tree, they are served tea from Alishan by 16 ""friendly ambassadors"" chosen from 2,137 applicants.","點燈儀式之後，台灣館的參觀動線也將告尾聲，最後一站的城市廣場，則是由多位南投工藝家以竹編技法創作的巨型大樹組合而成，當觀眾集結至「大樹下」納涼時，將有由 2,137 位報名者中脫穎而出的 16 名台灣「親善大使」，端出阿里山高山茶來「奉茶」。",97,64
75,"Coming into contact with a new culture can be confusing for people who've never had to deal with cultures other than their own, as Waters points out. For immigrants, the natural response is to start judging things according to what's different from their own culture, especially the negative things. For Waters, though, growing up in a multicultural environment taught him how to find the good in the differences too.",「對沒有接觸過不同文化的人來說，在與異文化首次相遇時，經常不知道該怎麼辦，」華適文說，面對移民，大家第一個自然反應往往是看到彼此相異之處，「而且是看到對方的壞處，」但從小就處在多元文化環境中，他卻學著去看好的不同點。,95,69
76,"But he didn't want to start so high. He rejected the offer, and asked to be employed as a laborer. A few days later he was digging post holes and doing other manual labor, installing braces and insulating plates on railway cable.",他開始了「做工」的生涯：每天八小時，從打地樁、扶樓梯、搬材料，做到裝置電車線上的三角架或絕緣板，這是與往日生活完全背道而馳的嶄新經驗﹘﹘在露天中工作，日曬、風吹、雨淋，白晰的膚色變黑、變粗，翩翩的外表也變得結實粗壯。,91,42
77,"The US has a long tradition of intangible asset insurance, so filmmakers can use the business plans of as yet unmade motion pictures as loan collateral. In the event that the movie cannot be finished on time, an insurance company, a third-party responsible for overseeing the completion of the work, finds a new production team and financial backers to finish it, thereby reducing the bank's risk.",美國很早就有為無形資產投保的保險公司，因此片商可以用還未拍攝的電影企劃案申請貸款，萬一電影無法在預定時間內拍完，負責監督完工的第三方保險公司就會負責為這個半成品找到新的製作團隊與出資者，以降低銀行風險。,96,66
78,Liu adds that the most joyfully surprising thing she's seen was a woman who gained the courage to realize her dream of traveling through Yunnan after staying at the hostel.,劉崇鳳還說，有時她人不在都蘭，就把客棧交給旅者當家做主，很多人事後寫信告訴她，「被託負掌管一個陌生居所，是多麼驚奇而榮幸的事！」最讓她驚喜的是，有個女生竟然因為待過小客棧，終而鼓起勇氣實踐壯遊雲南的夢想。,91,30
79,"We also encourage innovation: every year we hold innovation seminars to let everyone announce their R & D results. In the year 2000 our business has doubled, but our engineers still took the time to publish 83 papers. These all enriched our knowledge base, and today, with new data network technology, it is even easier for everyone to search that knowledge base and make use of its content.",同時我們也鼓勵創新，每年都舉辦創新研討會，讓大家發表研發成果，二○○○年中我們的業務增加了一倍，但工程師還是努力發表了八十三篇論文，這些都充實了我們的知識庫，現在有了新的資訊網路技術，更方便大家去搜尋、利用。,92,68
80,"But, as is true in many societies today, the young people of Chang Hua don't have the time or are simply not interested in studying traditional subjects.",由於在早期這是文人雅士和富貴人家的娛樂，許多老百姓也喜歡來唱唱、附庸風雅一下，所以十分流行。」如今年輕的一代忙著求學、做事，少有閒情和耐心來學這頗為「費工夫」的藝術，唯有老一輩獨撐場面；雖然偶會湧起「後繼無人」的感慨，他們還是興致勃勃地票戲。,106,27
81,"We didn't start the fire ... Wang Tsai-kuei's children's classical studies concept and his easily implemented teaching method are setting the Chinese community alight worldwide. The biggest chain reaction being set off by it, though, is in the culturally disconnected mainland. And over the past two decades, the works of Neo-Confucian and Buddhist scholar Nan Huaijin have been developing into the catalyst allowing it all to happen.",過去「加過了炭」王財貴完整的兒童讀經理念與簡單易行的教法，堪稱是燃起整個華人圈兒童讀經的「火種」，然而這一顆火種何以能在文化中斷的大陸引起這樣鋪天蓋地的連鎖反應，則與二十年來，南懷瑾大師的國學、佛學叢書鋪底加了飽足「炭火」大為有關。,104,67
82,"But when you know that the idea originated from Central Daily News editorial chief Shih Yung-kuei, who used to be TTV's general manager, the reason becomes clear. Having presided over a very popular matchmaking program in his television days, when he came to the newspaper he felt that the mass media should perform social services and thus designed the column.",但若知道構想的源起：中央日報社長石永貴，就可能恍然大悟﹘﹘曾擔任台灣電視公司總經理的他，在任內籌劃電視徵婚節目「我愛紅娘」，連續多年保持高收視率；到了報社之後，他一本初衷，認為大眾傳播媒體應擔負社會服務的使命，便又構思了這個專欄。,102,60
83,"Income earners 20 years and older can file as independents. These are the only categories that taxpayers fall into. In the United States couples have the choice to file separately or together with a joint return. If they decide to file jointly, their incomes are simply added together and divided by two to determine the taxable income under the unified tax table.",在這種情形下，如果張家先生一年賺廿四萬元，太太賺十二萬元，因先生收入的百分之廿已超過上限，因此只能扣除上限三萬六千元，太太依規定扣百分之卅，也是三萬六千元；李家剛好倒過來，先生賺十二萬、太太賺廿四萬，則兩人的扣除額分別是二萬四千元、七萬二千元。,110,62
84,"Yang Kuei-mei, nominated for her fourth Golden Horse award this year, was rewarded for her performance as a single mother struggling to raise her child in the 1960s, in the face of traditional constraints and the strains on their relationship when her daughter gets a boyfriend. Yang's performance switches expertly between suppressed emotion and passionate release, and the conflicts between mother and daughter are brought to vivid and realistic life.",四度入圍金馬獎的台灣演技派演員楊貴媚，飾演民國五十年代獨力撫養女兒成長的單親媽媽，在傳統觀念的壓抑下，面對女兒交往男友的態度扭曲，心境複雜。楊貴媚從拘謹壓抑到情慾釋放之間的角色轉折層次分明，母女關係的衝突張力也有細膩表現。,104,70
85,"""After we move to Hsinchu to work, we buy homes and get married. We have children, and our kids grow and go to school. We're bound to interact with our surroundings. We're bound to care, and pay attention to the living environment around us, the educational system, the conditions of society and so forth.",「科技人也是『人』，我們來到新竹工作後，在這裡買房子、結婚、小孩出生、成長、上學，一定要與環境互動，一定會關切、注意周遭的生活環境、學校教育、社會風氣等」，一位自民國八十二年就到新竹市家庭教育中心受訓，擔任心理諮商輔導義工的台積電員工表示。,102,54
86,"In 1983 members of the management went to Japan for inspection and instruction, and upon their return a new system of computer regulated machinery was installed.",經理黎成勳說，當時上海紡織業非常發達，制襯衫廠家很多，南華只是其一，產品除內銷外，還外銷至南洋一帶。民國卅八年南華隨政府撤退台灣，繼續投資設廠產制襯衫。黎成勳說，當時台灣物質十分缺乏，布料必須進口，工廠設備也很簡陋，只有幾部老式的平車機。,106,26
