,en,ch,Chinese length,English length
0,"Father gets up in the morning and reads the newspaper. ""After protests by women's groups, the lines were changed to"" Mother gets up in the morning and does morning exercises.",男女性別角色刻板印象也仍然無所不在，過去的小學課文中有「媽媽早起忙打掃… …，爸爸早起看書報」，經過女性團體的抗議，已經改成「媽媽早起做早操… …，爸爸早起看書報」。,67,30
1,"A lovely flower does not open often A lovely view does not exist everywhere Worries furrow a laughing brow Missing you brings tears to my eyes After you leave this night When will you come back again Or try ""More Than Words Can Say"": Don't know why But I'm surrounded by worry and fear Every day I pray That the loneliness of love Will soon be chased away.",試聽鄧麗君唱的「何日君再來」：好花不常開，好景不常在，愁堆解笑眉，淚灑相思帶。今宵離別後，何日君再來… …。和「千言萬語」：不知道為了什麼？憂愁它圍繞著我。,61,68
2,"Chiang has seen one after another of the passionate young people who took up community work with him desert their posts, some even making big money by taking up government projects in the name of pursuing community development, and admits that he sometimes feels very alone and wants to give up.",看到當初一起投入社造的龐大熱血青年紛紛撤離崗位，甚而有人轉而以社區之名、承接政府專案大賺其錢，「有時候也會感覺孤獨，想要放棄，」蔣耀賢承認。,62,51
3,"When an ill person seeks out Labay, she first tells the patient to go to a doctor. Only if the patient has been unable to find a cure over a long period does Labay then conclude that the illness is related to ancestral spirits, and begin to do divination and magic.",當病人找上拉拜．多鉻時，拉拜．多鉻會先請病人到醫院去給醫生看看，如果久病不愈，拉拜．多鉻認為，這才是因為祖靈的關係致病，而開始替病人占卜、施法。,62,51
4,Yet the ultimate aim of national education policy was to bring the country's children together in a school system with Malay as the medium of instruction.,然而，這份看似開明的報告書中卻留有一個伏筆：這個國家教育政策的最終目標，必須把各族的兒童集中在一個以「國語」（馬來語）為媒介的教育制度下。,61,26
5,"Combining traditional Eastern research with Western theory: This style of interpretative reading imbues David Wang's criticism with originality, insight, rich subtlety and the ability to startle; especially when directly discussing individual works, his writing is full of unexpected twists and turns, wit and humor.",結合東方傳統研究與西方理論這種解讀的方式，不但使得王德威的評論獨具立場，見解超達，而且復旨重出，姿態橫生；尤其在直接討論作品之際，更是曲折變化，妙趣歧出。,69,44
6,"The Bureau of Entry and Exit also indicates that multiple-exit permits are valid for three years and can be used up to twelve times, so that most people planning to leave the country an additional time need only go to the bureau to fill out a form and obtain a stamp of approval, rather than reapplying for a permit all over again.",入出境管理局並表示，一般人民出入境如已領有加簽證者，一張加簽證將有三年效期，並可使用十二次。因此第二次出境時不需再行申請，只需至境管局填表加簽即可。,68,62
7,"In addition to the basic living costs provided by her father, Yeh-tzu has to go out and earn her own spending money. She once skipped going to the convenience store where she worked and instead just played around, for which she received ""punishment"" of ten hours 'labor. But she says she accepted it without complaint.",除了靠父親支付居住基本費用外，必須自己賺取零用金的葉子，也曾經因為貪玩，沒去便利商店打工，遭受黃天人 10 小時勞務的「處罰」，但她表示，只有信服而無埋怨。,65,55
8,"Gourds were also used in ancestor worship, as attested by a reference in the classic scripture Li chi, or Book of Rites.",壺蘆在中國古代，也是一種禮器，周禮春官篇上說「凡祭祀榮門用瓢齎」；榮門就是國門，瓢齎是用瓢瓜為祭，以壺蘆上表純質之義，是一種國家祭典，莊嚴而慎重。,63,22
9,"And so since 2005, Taichung Prison has run three lacquerwork training courses, even hiring people like award-winning lacquer artist Shi Jiaxiang to teach.",自 2005 年起，台中監獄陸續開辦 3 期的「漆藝技訓班」，並延聘曾獲台灣省手工業研究所（今國立台灣工藝研究發展中心）「裝飾陶瓷創作獎」的漆藝名師史嘉祥等人「入獄」指導。,66,23
10,"[Director-General Shaw Yu-ming] Mr. Premier, Secretary-General Wang, friends from the press: The premier has wished to move up meeting with you since assuming office five weeks ago in order to strengthen communications, so he has decided to hold the first press conference of his premiership today.",（邵局長講話）院長、王秘書長、各位新聞界的朋友：院長就任五個禮拜以後，想跟各位提早見面，加強溝通，所以決定在今天舉行就任院長以後的首次記者會。,62,46
11,"Satellite TV firms in Taiwan, Hong Kong, and Macau are making the most of their shared language and culture, so in comparison to US and European media groups, they are better placed to get a foot in the door. Several Hong Kong TV stations have gradually obtained legal landing rights in some areas, and already possess sizeable audiences.",台、港、澳衛星電視台挾著語言、文化上的優勢，較之歐美集團，有更好的立足點，目前就有多家香港電視台已在大陸局部地區合法落地，並擁有數目可觀的收視戶。,65,58
12,"The cultured people of that time threw away the most exquisite things. Even in philosophy it was this way. Of course, there were also some old people who hadn't thrown away anything all their lives, but the young people--some even before they were able to reflect on what they were doing-- threw these things away just because they had been exposed to Western culture.",那個時代的文人，他們丟掉最精微的東西，連哲學也是如此，當然也有一些老一輩的人從來沒丟，但年輕人，有的還沒到可以反芻的年紀，就因為接觸西方，把這些東西全丟了。,70,64
13,"So ponders Chen Chung-shin, director of the Policy Research Center of the Democratic Progressive Party. The conservative image of former chairman Huang Kun-huei did not fit in with the idea of a more open policy, but that of ""Smiling Siew,"" with his economic background, does.",民進黨中央黨部政策研究中心主任陳忠信認為，以前任陸委會主委黃昆輝的保守形象，較不適合這樣的「基調」；而出身經貿的「微笑老蕭」就可能比較合適。,62,45
14,"In his third year at university, he started to learn translation. In those days, nobody worried too much about copyright, so he bought a second-hand English-language magazine and translated a number of short stories into Chinese, which he then sent to the family section of the Central Daily newspaper. After a number of tries, his work was finally accepted.",在政戰升上三年級後，賴世雄又開始學習翻譯工作，當時著作權法尚未實施，他從中華路的二手英文書報攤，選購有小說的英文雜誌進行翻譯，並試著寄給中央日報家庭版。,70,59
15,"Huang Fei-hong taught kungfu to Liu Yung-fu's Black Flag Army, and was the head martial arts instructor for Li Fu-lin's Fu Army. He also taught fighting skills to laborers in the vegetable, fruit and salted fish markets of Canton.",黃飛鴻曾在劉永福的黑旗軍裡當技擊教練，也曾在李福林的福軍中擔任總教練，又在當時廣州三欄（欄為批發市場之意）﹘﹘菜欄、水果欄、鹹魚欄教授勞動階層技擊。,65,39
16,"This being the case, it is important that we both think of ourselves as participants in a shared regional security framework. To that end, we need to maintain frequent cross-strait contacts, and we should participate in regional economic cooperation, academic exchanges, and international organizations. Regional cooperation must take the place of confrontation. This is the best way to ensure our national security.",從這個角度來看，我主張應藉由加強海峽兩岸互動、參與區域經濟合作、學術交流與國際組織，促進亞太集體安全意識，也就是以區域合作取代對抗，確保我國家安全。,67,62
17,"But the successful youth finds it difficult to avoid a certain wildness in his lovelife. Not one to refuse a woman or a man, by chance Han Dong purchases the favors of virgin Lan Yu, a male student who has just come to Beijing for studies. But due to Lan Yu's naivete and goodness, Han Dong unexpectedly tumbles into the river of love.",少年得志難免在情愛關係上狂浪不羈，男女來者不拒的他在偶然的機緣下買了初到北京求學少年「藍宇」的初夜，但卻意外地因藍宇的單純善良而墜入愛河。,64,63
18,"Wearing 3D glasses and using a mouse and keyboard to operate 3D imaging equipment, researchers and government officials can experience the effect of sitting in a helicopter overlooking all Taiwan. They can also easily compare changes to the island ’ s topography after a typhoon or earthquake. Typhoon Morakot, for example, devastated much of Southern Taiwan last year.",這麼一來，當研究者／政府官員戴上 3D 眼鏡，再配合滑鼠、鍵盤等簡單操作，就可體驗宛如坐在直昇機上俯瞰台灣各地的效果，也能輕易比對風災或強震過後的國土變貌。,67,58
19,"Hsueh Chin also feels that whether in terms of the history of Taiwan's settlement and development, or of the island's difficult path to democracy, or yet of the preservation of historical monuments, the stories and characters associated with the Li Family Compound in Luchou represent important milestones in Taiwan's modernization.",薛琴也覺得，不論是在北台灣的開發史、台灣民主化的艱辛過程，或在古蹟的保存工作上，蘆洲李宅所發生的故事及人物，都是台灣現代化重要的里程碑。,62,50
20,"Thus ""Operation Fairy Tale"" began.",於是他們動手整理中國各種民間故事，將故事改寫成淺顯、親切的白話文，並附上精美的插圖，編印成「中國童話」叢書，希望讓我們的下一代能自幼徜徉於中國歷代豐富的民間故事中。,74,5
21,"Lai later clarified that the TSU has been gradually putting the independence vs. reunification debate behind it and has now taken a center-left path that focuses on caring for the needs of the underprivileged, and that this is quite compatible with Ma Ying-jeou's ""no reunification, no independence, no war"" and Taiwan-centric stance, whereby the president puts top priority on safeguarding the interests of the people.",但其後賴幸媛澄清，台聯近來已逐漸超越統獨爭議，改走以照顧弱勢為主的「中間偏左」路線，這和馬英九總統一再揭櫫的「不統、不獨、不武」，以台灣為主體、確保民眾利益的施政理念並無二致。,76,65
22,"The small shop is open for business from 11 in the morning until midnight, 365 days of the year. It took in around NT $ 150,000 in February, and after rent, part-timers 'salaries, and food costs, it netted less than NT $ 20,000. While Liu is free, it's tough work physically and mentally. But he prepared himself from the outset to be in it for the long haul.",小店每天早上 11 點拉起鐵門、凌晨 12 點打烊，全年無休，2 月份的營業額約 15 萬元，扣除店租、工讀生薪水、食材成本等，賺不到 2 萬元，人雖自由，體力和心情一點也不輕鬆，但劉永新早有長期抗戰的心理準備。,78,68
23,"Premier Hau's parents also died early, so once they had met he channelled his affection for his lost parents into respect for Miss Kuo's family. Three years later he gained the support of all six of her uncles for their marriage. Only the grandmother expressed reservations. She had reared this granddaughter with her own hands and had never let her out of her sight.",而郝院長因為自己父母也過世得早，二人相識、交往後，就把對父母沒孝順到的遺憾，轉換成對郭女士家人的真心敬重，三年下來，也贏得六個叔叔伯伯對他們婚事的全力支持。,71,64
24,"According to World Health Organization statistics released on January 10, 2010, the H1N1 flu virus had resulted in the deaths of over 13,000 people during the previous six months. At 7016, North America suffered the largest number of deaths. It was followed by Europe (2788) and the western Pacific (1447). Taiwan had 38 deaths caused by the virus.","根據世界衛生組織截至今年 1 月 10 日的統計，H1N1 新流感延燒半年以來，已造成全球一萬三千多人死亡，美洲地區人數最多（7,016 人），其次為歐洲（2,788 人）、西太平洋地區（1,447 人），台灣也有 38 人因新流感死亡。",72,58
25,"Fewer foreign teachers In the past, English teaching placed too much emphasis on reading and writing, whereas now for most primary school students, ""learning to understand and speak is foremost, reading and writing is secondary."" Nevertheless many people have reservations about the pronunciation of the English teachers in our primary schools. Private language schools also seem aware of this, and many prominently advertise the fact that they employ foreign teachers.",相較於過去國中英文教學偏重讀寫，目前的小學英文多以「聽、說為主，讀、寫為輔」，但就有不少人質疑國小英文老師的發音能力；坊間補習班似乎也很清楚這個現象，多以外籍老師為招牌。,75,70
26,"The wife has the baby on her mind and can't relax, and then the husband then gets turned off by her attitude. Some people need to be in just the right state of mind or they can't make love. Some people need the excitement of illicit love. Everyone is different.",有些夫妻本來好端端的，生了孩子後忽然不行了，原來是太太惦著孩子，放不開，連帶弄得老公性趣全無；有人一定要心無掛慮才能做愛，有些人又偏喜偷情刺激，真是人人不同，各有所好。,75,50
27,"In her second year in university, she was on a trip with a classmate who enjoyed normal eyesight, and on the bus to Shei Pa National Park she heard everyone talking emphatically about some dog, but she didn't hear any dog sounds at all. Her classmate poked her hands down between the seats and discovered that there was indeed a furry creature squeezed in there!",大二時，她和視力正常的同學參加活動，在前往雪霸公園的遊覽車上，聽到大家在熱烈討論一隻「狗」，可是現場完全聽不到狗聲，她的同學忍不住往座位下的小縫一探究竟，發現裡面竟然「塞」了一隻狗。,80,65
28,"""Although you are carrying a camera, don't forget that first and foremost you are still a presidential bodyguard, and your prime duty is to protect the head of state."" Talking about his experiences as the president's photographer, Kao quotes these words, brief and to the point, with which his superior at Chihai made it clear to him how his role differed from that of an ordinary photographer.",「雖然背著照相機，別忘了骨子裡，你還是個侍衛官，護衛元首的安全是第一要務」，談起拍攝元首種種，高稚偉引了過去七海長官的一段話，扼要清楚地說明他與一般攝影的不同。,71,67
29,"Unfortunately, Chen Shui-bian's attitude hasn't changed a bit. He is adamant that the president holds the power to appoint the premier. His idea of coalition government is one in which the DPP calls all the shots, and absorbs another party like some sort of vassal state. The entire spirit of a government in which there is both a president and a premier has been tossed out the window.",可惜陳總統的心態似乎還沒調整好，他堅持總統有閣揆任命權，所謂聯合政府，一定是由民進黨主導作老大，然後用資源、權位的交換來吸收一個附庸黨，雙首長制的精神完全被丟掉了。,75,68
30,"Analyzing the replies more closely, we discovered that the positive opinions were mainly centered on such aspects as Japan's good infrastructure and its people's unity, law-abiding nature and efficiency, while negative opinions were mainly to do with the Japanese being aggressive, cruel, treacherous and materialistic. Both sets match closely with common stereotypes.",進一步細分，可以發現正面看法多集中在日本建設好、團結守法、有效率等方面；負面看法則是以日本人富侵略性、殘忍奸詐及現實為主，兩者都和一般人的刻板印象相當吻合。,71,52
31,"One can make up a form for each family member, with a photo and important information.",因此可以製作類似履歷表之表格，填錄基本資料，附上照片，再以傳記式記下生年中值得個人記憶的事蹟，諸如戀愛婚姻、工作、信仰、思想、交友等，並按編年方式逐年加入新資料。,71,16
32,"Though he plans to revise the work before 2005, adding more evidence, he admits, ""I don't know if I will be able to get enough time out of my busy schedule to finish the task."" The depth of the passions aroused and the general reception which Menzies has been accorded are no less than, and generally much greater than, those associated with many renowned professional historians.",他還計劃在二○○五年前再加入更多佐證、重寫這本著作，「也不知繁忙的行程裡能不能如期完成，」他說。相較國際知名的歷史學者，孟西士所受禮遇與熱門的程度有過之而無不及。,71,66
33,"""When we are short of money to run the place, we send a proposal to the township administration asking for assistance. Having volunteers willing to work every day is also among the museum's strongest supports."" Afraid that he might have been misunderstood, Liao called four hours after the interview to reiterate that they truly cherished the museum.",經費不足，我們寫企劃書向鎮公所爭取，而堅持不休息的義工團則是最佳後盾，」為了怕客語發音錯誤，採訪結束 4 個小時後，廖高仁在電話那頭慎重地說，「ngai beu cin siak ge ti fong gong（這是我們愛惜的地方館）」。,71,57
34,"Most are content to wear the school uniform, and appear introverted, conservative and shy.",兼家教也佔據師大人相當多的時間，主要原因是師大既是國立大學，又是培養師資的學校，學生家長很信任，找家教工作容易；而有些家境較清寒的學生，也需靠兼家教，以賺取較豐裕的生活費。,78,14
35,"But Ihergo, so widely praised by mothers and others, is actually the brainchild of two 20-something men, Leo Liu and Jeremy Chang. The two met while graduate students at North Carolina State University, and after returning to Taiwan both began working at IBM Taiwan. Seeing the opportunities of the Internet, these two fans of their company's group buys quit their jobs to tap the group buy market.",他們兩人是在美國北卡羅萊納州立大學攻讀碩士時相識，回國後又先後進入台灣 IBM 公司任職，看好網路商機，加上兩人都很「貪吃」，本來就是公司團購族裡的活躍份子，於是乾脆辭職投入這塊市場。,79,67
36,The three pitchers faced similar problems at first--they couldn't speak the language and couldn't get used to the food--but all agree that adjusting to the life style isn't the biggest difficulty.,郭泰源雖有球團配給他翻譯及廚子，但剛來的日子，仍是「什麼都不對」。而莊勝雄即使到現在，都還不太能接受日本料理當主食。儘管如此，三個人都不以為生活上的適應是最大的困難。,74,31
37,"Spellbound by temples Apart from the objects our host is just ""showing off,"" there is something else which testifies to the effort which Chen Yi-tsung has devoted in recent years to breathing new life into traditional designs. The nearly 10,000 slide photographs which he keeps in a dampproof metal cabinet are the expression of a 14-year love affair with traditional architecture.",除了主人正在「現」的東西，可看出陳益宗這幾年來致力賦予傳統圖案新生命的企圖，放在防潮鐵櫃內那近十萬張的幻燈片，則見證似地記錄他十四年來對傳統建築的用心與感情。,73,61
38,"One middle-aged baby-sitter from Neihu explained her difficulty: Children are the future of the family. Besides illness, the only way the parents can tell if you are lovingly caring for the child is whether the child is fat or thin.",一位住在內湖的中年保母說出她替人照顧孩子的難為處：孩子是人家的命根子，除了要盡心不要讓他生病以外；你是否賣力、真心照顧疼愛他，孩子的公婆爹娘所能看得到的就是他胖了，還是瘦。,79,40
39,"Chang Yen-hsien, an associate research fellow at the Institute of the Three Principles of the People at the Academia Sinica, argues that Taiwan is just going through a local manifestation of a global Japan fever.",中央研究院三民主義研究所副研究員張炎憲指出，由於日本這幾年的表現實在太好，「日本熱」的現象是全球性，「台灣發燒」只是其中一環而已，只能說大家對日本的興趣更大了。,71,35
40,"Major Published Works: Agricultural Development and Its Contributions to Development in Taiwan; An Economic Analysis of Agricultural Development on Taiwan; Instersectoral Capital Flows in the Economic Development of Taiwan; Initial Conditions of Agricultural and Development Policy; The Process and Pattern of Growth in the Agricultural Production of Taiwan; Agricultural Diversification and Development; A collection of his works was published in three volumes, 100 chapters, and 2,800 pages in 1983.",●重要著作：台灣農業發展對經濟成長之貢獻；台灣農業發展的經濟分析；台灣農工部門間的資本流通；台灣農業成長的過程與型態；農業多角化與發展等。民國七十二年結集為二千八百多頁、一百篇、三大本的論文集出版。,89,69
41,"Ku characterizes French designer Coco Chanel as the ""modern woman at the beach,"" and praises her for her promotion of fluid, easy-to-wear designs, her willingness to chuck out the ""meager aesthetics"" of excessive lace and embroidery, her emphasis on simplicity and her keen sense of the times.",如法國設計師香奈兒，辜振豐將之形容為「沙灘上的現代女性」，稱許她崇尚輕便自如、以儉樸為主，揚棄過度蕾絲贅繡的「貧乏美學」與敏銳的時代嗅覺，猶如「上流貴婦脫下馬甲（緊身束腹），穿起下女的衣著，輕便地走在沙灘。」,88,47
42,"In fact, New Asia was founded in Hongkong by scholars fleeing the mainland, taking the transmission of Chinese culture abroad as its purpose. Chung Chi was established by the representatives of a Hongkong Christian congregation in order to spread Chinese language Christian doctrine. And United was itself composed of five academies of higher education.",這當然是片面、籠統的說法，實際的情形是：新亞系由當時大陸流亡至港的知識分子所辦，以在海外傳承中華文化為己任；崇基為香港基督教會代表在香港所設，希望能傳揚中文基督教義；聯合則為五所專上院校集合而成。,90,54
43,"The performance then moves on to its spiritual theme- ""listening to the sea's heart."" A single male drummer appears. Close-cropped, bare-chested, and wearing a long cloth skirt, he slowly raises a large mallet with all the solemnity of a high priest and proceeds to slowly strike several large gongs. The sound washes over the audience like wave after wave upon the sands.",接著是表演的精神主題〈聽海之心〉，理著平頭，赤著上身，下紮一條布裙的男鼓手，以著宗教儀式般的肅穆舉起大槌，緩慢而悠長的敲擊多面大鑼，如同潮水在沙灘的輕撫，配合著梵唱一般的清唱，剎時，將觀眾帶離世間塵俗。,89,62
44,"People at Formosa Plastics like to say their plant in Texas represents the ""Asian spirit"" in action. ""In the West, labor and management are in opposition. When times are bad the workers are laid off without a second thought.",再以台塑到美設廠、買廠來說，「美國對於公害的管制，州有州政府的法律，地方還有地方政府的規定，每個地方對工廠廢氣、廢水的檢驗標準都不一樣，我們到德州建廠時，就花了三個月才摸清楚」，蘇忠正說。,82,39
45,"The result of this contact is to give these old films, stuck in warehouses for the last few decades, new life, and to bring them again into the light of day.",這些老片子是「地獄新娘」、「尋母三千里」、「賣油郎」、「你添丁我發財」… …，光看片名，就可想像它的劇情；而這樣的片名放在現今，能不能吸引觀眾？恐怕是個問題。但是就在廿、卅年前，它們風靡了台灣。且讓鏡頭轉到過去… …。,82,31
