,en,ch,Chinese length,English length
87,"From the sea urchin fossils embedded in the rock, you can surmise that before geologic activity caused these mountains to rise, Taiwan was once under the sea. More proof of this can be seen from the coastal plants that grow here, which prove that the land of Chihshan Park was once a small island.",例如這裡的地質非常特殊，從石頭裡鑲崁的海膽化石來說，可以推溯到地球的造山運動以前、台灣島還沈積在海底的時代，再佐證以公園裡原生的一些濱海植物，說明瞭芝山公園以前是一個小島，而如今，最近的海岸距離這裡至少二十多公里，可見滄海桑田的變化之劇。,110,54
88,"The headwaters of the Yangtze have been drying up in recent years, with declining water quality and increasing soil erosion. Adventurers and survey teams that have negotiated the river agree that desiccation and desertification have worsened-over the last decade, there has been a 20 % increase in the Yangtze region's desert areas. Grasslands have become sandy plains and dunes have swallowed the once-verdant lands of the headwaters.",尤其近年來長江源頭逐漸枯乾，水土破壞，早有「第二條黃河」之稱，漂流於長江的多位探險家與調查隊不約而同指出，長江沿岸乾化、沙化、荒漠化日益嚴重，十年來，江源地區的荒漠面積增加五分之一，草場成為沙場，滿目蔥蘢的水源之鄉，一個個慘遭沙丘吞沒。,104,67
89,"The next year, he began staying in the capital of Kwangtung province, perhaps the first foreigner for centuries to live in China.",利瑪竇於西元一五五二年生於義大利中部，明萬曆十一年（一五八三年）到達廣東肇慶，得知府王泮的幫助，成為元朝以後第一位獲准在中國長期居留的外國人。他終生在中國傳教，備受帝王公卿的尊重及一般百姓的敬愛，死後並獲明神宗賜葬北京。,101,22
90,"While mountain climbing brings to mind folks equipped with rucksacks and climbing shoes hiking their way up paths to conquer peaks, river trekking, a fun new way to the top, entails tracing up stream valleys in search of little patches of heaven.",肩上揹著背包，腳上穿著登山鞋，一步一步循著登山小徑逐漸爬上山頭，是一般人對於登山的既有印象；然而，這不過是抵達頂峰的方法之一；換一種方式從穿過山谷中的溪流，逐步逆流而上，尋覓位於山稜線那端的桃花源，更是別有一番樂趣的新興攻頂法。,104,42
91,"This declares that every child in the world is entitled to his or her rights ""without discrimination of any kind, irrespective of... race, color, sex, language, religion, political or other opinion, national, ethnic or social origin, property, disability, birth or other status.""",一九五九年，聯合國發表兒童權利宣言，直到一九八九年才通過「兒童權利公約」，向全世界明白揭示：「所有兒童，絕無例外，一律有權享受此等權利，不因其本人或家庭之種族、膚色、性別、語言、宗教、政治或其他主張、國族或家世、財產、出生或其他身份而有所軒輊或歧視。」,106,42
92,"Many people think first of Shih Pao Magazine for its political reporting, but managing editor, Cheng Shu-min, pointed out that the magazine has a much wider scope.",由於時報雜誌每期皆有有關國際及國內政情的文章，因此被許多人視為政論雜誌。發行人兼總編輯鄭淑敏說：「其實時報雜誌內容的範圍極廣，政論只不過是其中一部份；但是因政治話題比較敏感，讀者較感興趣，所以才會產生時報雜誌是政論雜誌的誤解。,104,27
93,"This suggestive light shines from the center of the universe, bringing heat to her body so that she can feel completely comfortable and at peace.",經過一波波對症紓解的想像，以及燈光、熱能的輔助感覺，小林被安撫下來，催眠結束前的最後，醫師要她想像汨汨熱能正像熔岩般從心中湧出，瀰漫室內，湧出街道、城市，擴張到地球、到宇宙四面八方，然後這股熱能回到她身上，可以感覺到全然的舒服、寧靜。,103,25
94,"Over the course of his lifetime, Niu Gur never put down his pen. Even when he was hospitalized, he would draw. It pained him to see how, as the nation has recently been again flooded with Japanese comics, the older cartoonists stopped drawing and the younger ones could be counted on the fingers of one hand. He wanted to establish a foundation whose sole purpose would be to cultivate domestic cartoonists.",牛哥一生從未停過筆，即使生病住院，畫筆仍不停手，他最感無奈的是，眼見老一輩的漫畫家已封筆，後起者屈指可數，而日本漫畫又以洪水般氾濫於國內，讓本土漫畫家幾乎無立錐之地，他很想成立基金會，目的無他，希望再為國內培養出色的漫畫家。,101,71
95,"""After all,"" he said, ""I was chosen to represent 'China' at an international meeting.""",姜友陸雖對自由中國頗具好感，但基於科學家「實事求是」的態度，他表示願意悄然前往，必得在「眼見為信」之後，他才願意公開表示對自由中國的支持與擁護。姜友陸說：「我是一個學科學的，對任何事情不僅要先經過嚴密的思考，更要進一步驗證，才願意相信。,103,14
96,"What follows is an interview with Li that was conducted on the eve of the handover. Q: When you assume your new post in Macau in 2000, will the challenges be different from when you headed the Trade and Tourism Office there?",以下是澳門治權移交前夕，本刊對厲威廉處長的專訪，厲處長耶魯大學畢業，曾任陸委會聯絡室、港澳處處長，去年一月赴澳履新，在澳門治權轉移的重要時刻步步為營，悉心拓展台澳關係。問：厲處長去年一月走馬上任，在澳門治權轉移前後，辦事處的工作挑戰有何不同？,109,42
97,In the vertebrate laboratory of the biology department at National Taiwan Normal University stands a pair of refrigerators.,台灣地區有全世界十二分之一種類的動植物，其中不少為特有或稀有種。本欄將陸續為您介紹這些以稀為貴的動植物。此期介紹生長於二千公尺以上高山、耐寒力足可媲美「愛斯基摩人」的兩棲類特稀有動物﹘﹘山椒魚。師大生物系脊椎動物實驗室裡，有兩台冰箱。,106,18
98,"Their head office is located near the Black Forest, along the Franco-German border. When Chou Kuang-chung went there for training, he finally saw the natural beauty evoked by poets and painters. There are hiking, cycling, and even horse-riding trails throughout the Black Forest. Only three kilometers away is the French border, where a wide variety of mouth-watering, inexpensive food can be had.",「貝克總公司座落在德、法邊境上，緊鄰著名的黑森林區，」曾經前往受訓的貝克航電周光中博士表示，到了那裡，才知道何謂「山明水秀，風景如畫」，在廣袤的黑森林區，可以徒步徜徉、騎自行車，甚至驅馬馳騁；而三公里外就是法國邊境，精緻而便宜的美食令人垂涎。,104,62
99,"A rare species, the Mikado pheasant, once was common in Taiwan's forests.",台灣的氣候非常適宜繁育雉雞，飼料是以高蛋白質熱量來配賦，一年可以產卵七、八十個，每年僅交尾一次。公雉羽毛拔去後，約四十餘天即再長成，而其羽毛色彩明麗奪目，不遜孔雀，因此，成為台灣手工藝品的材料，製成精美的雉毛領帶、皮包，銷售國內外。,102,12
